{
  "annotation_version": "2.0.1",
  "review_status": "approved",
  "review_role": "technical-inspection",
  "independent_human_assessment": false,
  "scope": "Audit all 55 new RAG inventories. Amend only requested-answer coverage, missingness, equal-authority conflicts, and an unresolved referent. Unknown answer slots have canonical_value=null. Preserve the 200-case release, queries, evidence, sample answers, input plan, original approvals, raw model artifacts, all other metrics, and threshold. Original dialogue and authorship approvals remain source-specific; annotation approval is recorded separately.",
  "base_hashes": {
    "configs/week-03.json": "316819dee81fa28bdf190adeada051e02ad8f8d98388a21f84a987e363e95cb1",
    "data/W01_Evaluation_Dataset_v2.jsonl": "42620b25fee64ae36c0ccd03badb0f1964d683f7e1129b335c58aee965db3be8",
    "data/W01_Evaluation_Dataset_v2.manifest.json": "20492441d37912efe3c0289fbfc60b4e3a1271bca0daee14b24a05a7099a8800",
    "results/week-03/w03-qwen25-7b-mlx4bit-text-v1/run_manifest.json": "490e04abc4c3a508f7f09753b016038935b0d701552b40a87eddbbdb24ab8bc2",
    "results/week-03/w03-qwen25-7b-mlx4bit-text-v1/dataset.jsonl": "42620b25fee64ae36c0ccd03badb0f1964d683f7e1129b335c58aee965db3be8",
    "results/week-03/w03-qwen25-7b-mlx4bit-text-v1/inputs.jsonl": "f98d34ed28914f8ceb64bf65bd7a1ea89e71d3f30b587dd4d01ed56fac4fc58e",
    "results/week-03/w03-qwen25-7b-mlx4bit-text-v1/responses.jsonl": "1838fa37b6e880723c5c8f73021dd0befecd26964c19f89e1240ed54c804914c",
    "results/week-03/w03-qwen25-7b-mlx4bit-text-v1/claims.jsonl": "abd0b29fd02a984b06af347fdcd60790f956395f413c94238b56635277ca1160",
    "results/week-03/w03-qwen25-7b-mlx4bit-text-v1/claim_review.json": "3f97fdd768034800299f6807af0621de35c97de7c4f429d38d62d84271e53b8c",
    "results/week-03/w03-qwen25-7b-mlx4bit-text-v1/calibration.json": "97dd16da7cbebb386dc87c84d3068fcf4cbf70a535095e7e0cdee362d26a9cad",
    "results/week-03/w03-qwen25-7b-mlx4bit-text-v1/scores.json": "032127033d1b1d570931af7add18132cf09e38119586d37c6c825ff55f7af51c",
    "results/week-03/w03-qwen25-7b-mlx4bit-text-v1/embeddings.json": "1d59e1224da232c56ab979bbef361bad173db9d3cea3936c58963e4020e6f3a2",
    "results/week-03/w03-qwen25-7b-mlx4bit-text-v1/embeddings.npz": "5900042c9812369a4b5645f70f700650ee1413de10617bfae4d30c303ba98fee"
  },
  "audited_case_ids": [
    "w03-rag-fari-en-0101-base",
    "w03-rag-fari-zh-0102-base",
    "w03-rag-senpai-en-0103-base",
    "w03-rag-senpai-en-0109-base",
    "w03-rag-fari-en-0113-base",
    "w03-rag-fari-en-0114-base",
    "w03-rag-fari-en-0115-base",
    "w03-rag-fari-en-0116-base",
    "w03-rag-fari-en-0117-base",
    "w03-rag-fari-en-0118-base",
    "w03-rag-fari-en-0119-base",
    "w03-rag-fari-en-0120-base",
    "w03-rag-fari-zh-0121-base",
    "w03-rag-fari-zh-0122-base",
    "w03-rag-fari-zh-0123-base",
    "w03-rag-fari-zh-0124-base",
    "w03-rag-senpai-en-0125-base",
    "w03-rag-senpai-en-0126-base",
    "w03-rag-senpai-en-0127-base",
    "w03-rag-senpai-en-0128-base",
    "w03-rag-senpai-zh-0129-base",
    "w03-rag-senpai-zh-0130-base",
    "w03-rag-fari-en-0168-base",
    "w03-rag-fari-en-0169-base",
    "w03-rag-fari-en-0170-base",
    "w03-rag-fari-zh-0171-base",
    "w03-rag-fari-zh-0172-base",
    "w03-rag-senpai-en-0173-base",
    "w03-rag-senpai-en-0174-base",
    "w03-rag-senpai-zh-0175-base",
    "w03-rag-senpai-zh-0176-base",
    "w03-rag-fari-en-0177-base",
    "w03-rag-fari-en-0178-base",
    "w03-rag-fari-en-0179-base",
    "w03-rag-fari-en-0180-base",
    "w03-rag-fari-en-0181-base",
    "w03-rag-fari-en-0182-base",
    "w03-rag-fari-en-0183-base",
    "w03-rag-fari-en-0184-base",
    "w03-rag-fari-en-0185-base",
    "w03-rag-fari-en-0186-base",
    "w03-rag-fari-zh-0187-base",
    "w03-rag-fari-zh-0188-base",
    "w03-rag-fari-zh-0189-base",
    "w03-rag-fari-zh-0190-base",
    "w03-rag-fari-zh-0191-base",
    "w03-rag-senpai-en-0192-base",
    "w03-rag-senpai-en-0193-base",
    "w03-rag-senpai-en-0194-base",
    "w03-rag-senpai-en-0195-base",
    "w03-rag-senpai-en-0196-base",
    "w03-rag-senpai-zh-0197-base",
    "w03-rag-senpai-zh-0198-base",
    "w03-rag-senpai-zh-0199-base",
    "w03-rag-senpai-zh-0200-base"
  ],
  "edits": [
    {
      "id": "w03-rag-fari-en-0101-base",
      "before": [
        {
          "fact_id": "f001",
          "text": "Nora's pottery group starts at 2:30 p.m. today.",
          "equivalence_notes": "Equivalent natural spoken wording is accepted.",
          "context_support": "supported",
          "evidence_passage_ids": [
            "p001"
          ],
          "source_ids": [
            "scenario-w03-0101"
          ],
          "verification_notes": "Directly stated in the linked passage."
        },
        {
          "fact_id": "f002",
          "text": "The supplied notice does not name a room.",
          "equivalence_notes": "Equivalent natural spoken wording is accepted.",
          "context_support": "supported",
          "evidence_passage_ids": [
            "p001"
          ],
          "source_ids": [
            "scenario-w03-0101"
          ],
          "verification_notes": "Directly stated in the linked passage."
        }
      ],
      "after": [
        {
          "fact_id": "f001",
          "text": "Nora's pottery group starts at 2:30 p.m. today.",
          "equivalence_notes": "Equivalent natural spoken wording is accepted.",
          "context_support": "supported",
          "evidence_passage_ids": [
            "p001"
          ],
          "source_ids": [
            "scenario-w03-0101"
          ],
          "verification_notes": "Directly stated in the linked passage."
        },
        {
          "fact_id": "f002",
          "text": "Room assigned to Nora's pottery group today.",
          "equivalence_notes": "Requested answer slot only; no canonical value is established or invented. This is not an assertion of a hidden value.",
          "context_support": "unsupported",
          "evidence_passage_ids": [],
          "source_ids": [
            "scenario-w03-0101"
          ],
          "verification_notes": "No authoritative supplied evidence establishes the requested value. Missingness is recorded separately as a behavior observation."
        }
      ],
      "unresolved_answer_slots": [
        {
          "fact_id": "f002",
          "requested_information": "Room assigned to Nora's pottery group today.",
          "canonical_value": null
        }
      ],
      "behavior_observations": [
        "Nora's pottery group starts at 2:30 p.m. today.",
        "The supplied notice does not name a room."
      ],
      "rationale": "Keep the established first answer component; count the requested second component as unavailable instead of crediting a supported statement about its absence."
    },
    {
      "id": "w03-rag-fari-en-0113-base",
      "before": [
        {
          "fact_id": "f001",
          "text": "Nora's parcel arrived at reception at 10:15 a.m.",
          "equivalence_notes": "Equivalent natural spoken wording is accepted.",
          "context_support": "supported",
          "evidence_passage_ids": [
            "p001"
          ],
          "source_ids": [
            "scenario-w03-0113"
          ],
          "verification_notes": "Explicitly established by the linked evidence."
        },
        {
          "fact_id": "f002",
          "text": "The log does not identify the signer.",
          "equivalence_notes": "Equivalent natural spoken wording is accepted.",
          "context_support": "supported",
          "evidence_passage_ids": [
            "p001"
          ],
          "source_ids": [
            "scenario-w03-0113"
          ],
          "verification_notes": "Explicitly established by the linked evidence."
        }
      ],
      "after": [
        {
          "fact_id": "f001",
          "text": "Nora's parcel arrived at reception at 10:15 a.m.",
          "equivalence_notes": "Equivalent natural spoken wording is accepted.",
          "context_support": "supported",
          "evidence_passage_ids": [
            "p001"
          ],
          "source_ids": [
            "scenario-w03-0113"
          ],
          "verification_notes": "Explicitly established by the linked evidence."
        },
        {
          "fact_id": "f002",
          "text": "Identity of the person who signed for Nora's parcel.",
          "equivalence_notes": "Requested answer slot only; no canonical value is established or invented. This is not an assertion of a hidden value.",
          "context_support": "unsupported",
          "evidence_passage_ids": [],
          "source_ids": [
            "scenario-w03-0113"
          ],
          "verification_notes": "No authoritative supplied evidence establishes the requested value. Missingness is recorded separately as a behavior observation."
        }
      ],
      "unresolved_answer_slots": [
        {
          "fact_id": "f002",
          "requested_information": "Identity of the person who signed for Nora's parcel.",
          "canonical_value": null
        }
      ],
      "behavior_observations": [
        "Nora's parcel arrived at reception at 10:15 a.m.",
        "The log does not identify the signer."
      ],
      "rationale": "Keep the established first answer component; count the requested second component as unavailable instead of crediting a supported statement about its absence."
    },
    {
      "id": "w03-rag-fari-en-0114-base",
      "before": [
        {
          "fact_id": "f001",
          "text": "No final chair choice is recorded.",
          "equivalence_notes": "Equivalent natural spoken wording is accepted.",
          "context_support": "supported",
          "evidence_passage_ids": [
            "p001"
          ],
          "source_ids": [
            "scenario-w03-0114"
          ],
          "verification_notes": "Explicitly established by the linked evidence."
        }
      ],
      "after": [
        {